{
  "basis": {
    "active_reader_input_ref": {
      "path": "sources/2026-W33/publication/v2/reader-surface-input-v2.json",
      "sha256": "27ecce484d94775719a2974cfc665cb4517f791f37bc629c6348111b5588e08e"
    },
    "active_revalidation_ref": null,
    "before_graph_digest": "b7af8f21b2cad727b40da7fa9cb9ca5859f1a86f48a111bfbe07bfa972939db2",
    "contract_identity": {
      "pipeline_contract_sha256": "3adfbda22131eac4017ef867aef2ebb2f346f884731c4ea8343e9062392eabd5",
      "pipeline_contract_version": "2.0-rc1",
      "publication_profile_sha256": "99adff93ff443e02bdcce639ce5fc4d4c959ee45a804da70efc4277db57fdddb",
      "publication_profile_version": "2.0-rc1",
      "quality_contract_sha256": "b5b955d524fb438c0f1b2c9490bea1da2083e79028d67a55ca424bbfc20f2958",
      "quality_contract_version": "2.0-rc1",
      "research_profile_sha256": "666f8a064b190ffd35216e26d6fdf2dd0fa932cac7b1b0d6448e262ded77b9a8",
      "research_profile_version": "2.0-rc1"
    },
    "generated_receipt_ref": {
      "path": "sources/2026-W33/publication/v2/validated-source-manifest.json",
      "sha256": "ffaf06eafe190dabef5aa0499e802cd631a7f3dd6455709197c84d85e856a9f3"
    },
    "preserved_upstream_digest": "964505922d86bf7ea6108950c651b96fdc6078a71279cbc97df53cd4914e196f",
    "renderer_commit": "85bf2103c72c846477d4037f12066cce30639761",
    "state_ref": {
      "path": "sources/2026-W33/production-state.json",
      "sha256": "8cb8a6445e7e2d2f0a5e084f0fbf3d6f7bf348eedb3226c9a15d544becb43e9f"
    },
    "validation_checkpoint_ref": {
      "path": "sources/2026-W33/orchestration/v2/checkpoints/DRAFT_COMPLETE.json",
      "sha256": "d4fd37553dbe3b9a007ea2575be983beee2c8f235d713e5937622b4fd9a7c8db"
    }
  },
  "code_deps": [
    {
      "byte_count": 218,
      "path": ".latexmkrc",
      "sha256": "18199fd85e3e3c46ede9322a709e4f64e39470f69c6c20935e598d4c08adbc26"
    },
    {
      "byte_count": 3793,
      "path": "schemas/discovery-acceptance-v2.schema.json",
      "sha256": "8ebf6e111a97bdd4b30ae5e430e20898718d0b469688fb38e1b0f7d8763db4fe"
    },
    {
      "byte_count": 14629,
      "path": "schemas/dm022-preadoption-report-v2.schema.json",
      "sha256": "10238a1af7330e5352cbbad709e6360797fade789f184126f296fbeb3e82e4db"
    },
    {
      "byte_count": 8773,
      "path": "schemas/dm022-revision-manifest-v2.schema.json",
      "sha256": "e7534d019ec1b58672ff306ac901d65669e2c64251fe41964df2e81e356fbaf4"
    },
    {
      "byte_count": 7403,
      "path": "schemas/dm022-revision-proof-v2.schema.json",
      "sha256": "a79c09209c145d485ec39e1c1c277f0d706cf3ccfb0972c5bd9f6d6fe7cec5c3"
    },
    {
      "byte_count": 18648,
      "path": "schemas/dm022-revision-request-v2.schema.json",
      "sha256": "a99f0dc1f6e10ae5736063a051ef3b147eb85bccf20e435db87054a2bac1a31f"
    },
    {
      "byte_count": 7259,
      "path": "schemas/dm022-supersession-checkpoint-v2.schema.json",
      "sha256": "fd39c246617293ecb6760906534512e2b5a14a484916c3d1f3ba055b33d3bec0"
    },
    {
      "byte_count": 3945,
      "path": "schemas/editorial-correction-proposal-v2.schema.json",
      "sha256": "5623c0d92e3dfc5415e1ab73c73b3d5f1b147f265f2255469cede2ec333a4607"
    },
    {
      "byte_count": 2338,
      "path": "schemas/editorial-manuscript-spec-v2.schema.json",
      "sha256": "043ce8a565385549265d6666642c2e3ec8ce0d8e8e5544a7eddfb32691478250"
    },
    {
      "byte_count": 2972,
      "path": "schemas/editorial-publication-build-record-v2.schema.json",
      "sha256": "b7c82476047373995cd5c4733ce2ba0b1c53fef72a84bceb26feec9078fea4ba"
    },
    {
      "byte_count": 3107,
      "path": "schemas/editorial-publication-set-v2.schema.json",
      "sha256": "7beebcef48d7777144f7df7ce3fddc27c0d39df685fdc49cbfdd7d798c7e61e9"
    },
    {
      "byte_count": 3047,
      "path": "schemas/editorial-publication-source-manifest-v2.schema.json",
      "sha256": "494a1d152c76bca810d30e743d567210f130cb4197561d82b276f24ef69441bc"
    },
    {
      "byte_count": 5618,
      "path": "schemas/editorial-retention-manifest-v2.schema.json",
      "sha256": "347e5499259ac878e28bc66b4e9ea62af1f5eb71a3f428558120a9f5d549855c"
    },
    {
      "byte_count": 5627,
      "path": "schemas/editorial-staged-source-manifest-v2.schema.json",
      "sha256": "4fa6172338072258f1f3c204b27331ac79a35b2af9d42ac6a2e8be7a34e32e46"
    },
    {
      "byte_count": 868,
      "path": "schemas/editorial-toolchain-spec-v2.schema.json",
      "sha256": "50b5dc3ee05c496b2c2da13377c5ee0a883dfb52d9b9785189cb00a75d6e4db4"
    },
    {
      "byte_count": 3301,
      "path": "schemas/publication-candidate-v2.schema.json",
      "sha256": "a3fe0bc8dc21f79668e7017914f1e14b8933e1fb1cd7826c3a6515e01b42ed59"
    },
    {
      "byte_count": 13479,
      "path": "schemas/publication-surface-revalidation.schema.json",
      "sha256": "0376c7b43941c6b99d699996372572e04e9b4c98f495e5a5e3287163f37b23a5"
    },
    {
      "byte_count": 4229,
      "path": "schemas/quality-regression-bundle-v2.schema.json",
      "sha256": "3aaf17255baba111d9f96dce2c90640380a38dbd691b82ac838eb7a33392c2bf"
    },
    {
      "byte_count": 6315,
      "path": "schemas/reader-manuscript-v2.schema.json",
      "sha256": "426f5a3689e2bc2829138893a8a28f0fc1fc6e696d373419a49f5cf16e8bb4f3"
    },
    {
      "byte_count": 8803,
      "path": "schemas/reader-surface-gate-v2.schema.json",
      "sha256": "a734235caab222d30e78e2fea17f3a376d101368c482ec8d91371a1d7bb81f4b"
    },
    {
      "byte_count": 5676,
      "path": "schemas/reader-surface-input-v2.schema.json",
      "sha256": "8db11d4eb0dfa1a0c66beeab6ef5ad0b7008bda88f72a3e16df13a17dea4289c"
    },
    {
      "byte_count": 4219,
      "path": "schemas/reader-surface-semantic-review-v2.schema.json",
      "sha256": "e8598239d3ca00441f61110fd77a7b7edf063ac15a7a6a1c2efdb38e73d6699b"
    },
    {
      "byte_count": 2016,
      "path": "schemas/screening-v2-batch-result.schema.json",
      "sha256": "a05b65b41efbcaf654df5c3c5944254a76d93d8a28cab961f2c06f6d580da5a2"
    },
    {
      "byte_count": 3409,
      "path": "schemas/screening-v2-run-package.schema.json",
      "sha256": "3cafe04825de74701acadea66eaefdc882d7b312af835cf2ebd70caaaa7f4567"
    },
    {
      "byte_count": 2310,
      "path": "schemas/survey-discovery-record.schema.json",
      "sha256": "a8a63f6b5eb64d786860676b4e1f844f107109b84b0ea31f8a94f6971fdc250c"
    },
    {
      "byte_count": 8322,
      "path": "schemas/versioned-renewal-basis-v2.schema.json",
      "sha256": "76f77ee552ef430756d7acd9c8f6d780c1d7d4ac12aca976b49cd552914c4aad"
    },
    {
      "byte_count": 3266,
      "path": "schemas/versioned-renewal-publication-set-v2.schema.json",
      "sha256": "a7594e63db178016038787307c54f680d4cef53020577676ac1aaa7e2e739354"
    },
    {
      "byte_count": 11138,
      "path": "schemas/versioned-renewal-source-manifest-v2.schema.json",
      "sha256": "9d58894ef8b60315c8e8405206d31764f10f4030b1e71ffdd870bf650cf28c42"
    },
    {
      "byte_count": 7222,
      "path": "schemas/versioned-renewal-source-proof-v2.schema.json",
      "sha256": "4c6413ea243d8131589cced31c677167b94654f4cda118812704d3a69aa2f493"
    },
    {
      "byte_count": 2714,
      "path": "schemas/weekly-publication-source-manifest-v2.schema.json",
      "sha256": "c11ad525c6f8dd2a8f9d68647a3675bbac6988e6cdace54762ce145143c3b578"
    },
    {
      "byte_count": 11304,
      "path": "scripts/render_article_draft_tex.py",
      "sha256": "9c64ebce313a09ffa1263b2437736e1459dcd2e97e41611bff5cd669d6c16328"
    },
    {
      "byte_count": 195749,
      "path": "scripts/survey_agent_control_v2.py",
      "sha256": "b6506a8b334408bc99c5baff655afe0e5719817aa89bf4efd40429153b5f2638"
    },
    {
      "byte_count": 8207,
      "path": "scripts/survey_agent_tool_v2.py",
      "sha256": "0ff3bd9a0b13509554f82bf2a4c5e729fb2d5eea61097816076f3eaa8f84dd64"
    },
    {
      "byte_count": 4932,
      "path": "scripts/survey_architecture_v2.py",
      "sha256": "472a9dca98f339f6864dc1ff42f50245d5ebbf388f1ab0a0181198e1fd44cda2"
    },
    {
      "byte_count": 47416,
      "path": "scripts/survey_architecture_v2_base.py",
      "sha256": "ac52c842afa12c92219a874fc1d2c2d7325769cf2e04507c479879c92858edf4"
    },
    {
      "byte_count": 9658,
      "path": "scripts/survey_bibliography_access_provenance_v2.py",
      "sha256": "202cc916521ba1fe6eafa25dbab0971c85d01bdf706db0e4976642cc4fb8f981"
    },
    {
      "byte_count": 11843,
      "path": "scripts/survey_completeness_v2.py",
      "sha256": "ba551ba44bc37276f6949569a43f339ec84da67da5953d31547b63690be9c7e1"
    },
    {
      "byte_count": 14044,
      "path": "scripts/survey_discovery_v2.py",
      "sha256": "dc1897bec4029507b596f5160216f1f79020c83489e76ad076b4aa01e55dbfe7"
    },
    {
      "byte_count": 4032,
      "path": "scripts/survey_drafting_citation_refs_v2.py",
      "sha256": "b6aa6d9b40e0b3cba299e2080ba9d05289ebe1680782e18e418e643e6d9e24e7"
    },
    {
      "byte_count": 26740,
      "path": "scripts/survey_drafting_v2.py",
      "sha256": "4f332258b5801d02aa9d767191aac61069a7ff11b1af882744658baef6efce72"
    },
    {
      "byte_count": 63592,
      "path": "scripts/survey_drafting_v2_base.py",
      "sha256": "2fad48283609c2dbd4fb7bd665ffa5a2fe28e2b63e09450713b2dbfad1bf27e1"
    },
    {
      "byte_count": 164138,
      "path": "scripts/survey_editorial_correction_proposal_v2.py",
      "sha256": "00ceb52606b0051880349e7addf170c2443c89408b521d803c3fcde5287172bc"
    },
    {
      "byte_count": 43792,
      "path": "scripts/survey_editorial_current_authority_v2.py",
      "sha256": "0316f24ecae8e9b6f38c1758ddcfc57b5c3c30e3df8c2eb65e6bd260fa1a190c"
    },
    {
      "byte_count": 275939,
      "path": "scripts/survey_editorial_publication_v2.py",
      "sha256": "3a8721569d3cb1512501699ecf78d7c7e3679120cfb9b06504fa1471bfdee722"
    },
    {
      "byte_count": 124753,
      "path": "scripts/survey_editorial_retention_v2.py",